{
  "$schema": "../schema/core_schema.json",
  "metadata": {
    "name": "Universal Enterprise Ontology Core",
    "layer": "L1_universal_organization_ontology",
    "version": "2.1.0",
    "license": "Apache-2.0",
    "namespace": "https://github.com/ramphias/universal-ontology-definition/core/",
    "description": "适用于所有企业的组织通用 ontology 核心，定义了跨行业、跨企业的核心概念、关系与实例。v2.0 引入抽象域根类、泛型关系与版本演进机制。",
    "description_en": "Universal organization ontology core applicable to all enterprises. v2.0 introduces abstract domain roots, generalized relations, and lifecycle management.",
    "created": "2026-03-29",
    "updated": "2026-04-11",
    "contributors": [
      "Universal Ontology Definition Contributors"
    ]
  },
  "classes": [
    {
      "id": "Entity",
      "label_zh": "实体",
      "label_en": "Entity",
      "parent": null,
      "abstract": true,
      "status": "stable",
      "since": "2.0.0",
      "definition": "所有可被识别和管理的事物的顶层抽象",
      "definition_en": "Top-level abstraction for all identifiable and manageable things"
    },
    {
      "id": "Party",
      "label_zh": "主体",
      "label_en": "Party",
      "parent": "Entity",
      "abstract": true,
      "status": "stable",
      "since": "1.0.0",
      "definition": "可参与业务关系与治理关系的主体总类",
      "definition_en": "The superclass of all entities that can participate in business and governance relationships"
    },
    {
      "id": "Person",
      "label_zh": "人员",
      "label_en": "Person",
      "parent": "Party",
      "abstract": false,
      "status": "stable",
      "since": "1.0.0",
      "definition": "自然人主体",
      "definition_en": "A natural person entity"
    },
    {
      "id": "Organization",
      "label_zh": "组织",
      "label_en": "Organization",
      "parent": "Party",
      "abstract": false,
      "status": "stable",
      "since": "1.0.0",
      "definition": "法人或非法人组织",
      "definition_en": "A legal or non-legal organization entity"
    },
    {
      "id": "OrgUnit",
      "label_zh": "组织单元",
      "label_en": "Organizational Unit",
      "parent": "Organization",
      "abstract": false,
      "status": "stable",
      "since": "1.0.0",
      "definition": "部门、团队、委员会、项目群等组织内部单元",
      "definition_en": "Internal organizational units such as departments, teams, committees, and program groups"
    },
    {
      "id": "Resource",
      "label_zh": "资源",
      "label_en": "Resource",
      "parent": "Entity",
      "abstract": true,
      "status": "stable",
      "since": "2.0.0",
      "definition": "被业务过程创建、变更、管理、消费的有形或无形资源",
      "definition_en": "Tangible or intangible resources created, modified, managed, or consumed by business processes"
    },
    {
      "id": "ProductService",
      "label_zh": "产品和服务",
      "label_en": "Product & Service",
      "parent": "Resource",
      "abstract": false,
      "status": "stable",
      "since": "1.0.0",
      "definition": "企业对外提供或内部使用的产品和服务对象",
      "definition_en": "Products and services provided externally or used internally by an enterprise"
    },
    {
      "id": "Asset",
      "label_zh": "资产",
      "label_en": "Asset",
      "parent": "Resource",
      "abstract": false,
      "status": "stable",
      "since": "1.0.0",
      "definition": "财务、实物、知识、数据、品牌等资产",
      "definition_en": "Financial, physical, knowledge, data, brand, and other assets"
    },
    {
      "id": "DataObject",
      "label_zh": "数据对象",
      "label_en": "Data Object",
      "parent": "Resource",
      "abstract": false,
      "status": "stable",
      "since": "1.0.0",
      "definition": "结构化或非结构化的数据实体",
      "definition_en": "A structured or unstructured data entity"
    },
    {
      "id": "Document",
      "label_zh": "文档与记录",
      "label_en": "Document",
      "parent": "DataObject",
      "abstract": false,
      "status": "stable",
      "since": "2.0.0",
      "replaced_from": "DocumentRecord",
      "definition": "合同、报告、文件、单据、记录",
      "definition_en": "Contracts, reports, files, documents, and records"
    },
    {
      "id": "SystemApplication",
      "label_zh": "系统应用",
      "label_en": "System Application",
      "parent": "Resource",
      "abstract": false,
      "status": "stable",
      "since": "1.0.0",
      "definition": "支撑流程、数据和决策的软件系统",
      "definition_en": "Software systems supporting processes, data, and decision-making"
    },
    {
      "id": "Governance",
      "label_zh": "治理",
      "label_en": "Governance",
      "parent": null,
      "abstract": true,
      "status": "stable",
      "since": "2.0.0",
      "definition": "用于约束、治理和风险管控的抽象域",
      "definition_en": "Abstract domain for constraints, governance, and risk management"
    },
    {
      "id": "Policy",
      "label_zh": "政策",
      "label_en": "Policy",
      "parent": "Governance",
      "abstract": false,
      "status": "stable",
      "since": "1.0.0",
      "definition": "管理原则与约束要求",
      "definition_en": "Management principles and constraint requirements"
    },
    {
      "id": "Rule",
      "label_zh": "规则",
      "label_en": "Rule",
      "parent": "Governance",
      "abstract": false,
      "status": "stable",
      "since": "1.0.0",
      "definition": "可执行、可判断的业务或控制规则",
      "definition_en": "Executable and evaluable business or control rules"
    },
    {
      "id": "Control",
      "label_zh": "控制",
      "label_en": "Control",
      "parent": "Governance",
      "abstract": false,
      "status": "stable",
      "since": "1.0.0",
      "definition": "用于降低风险、保障合规和质量的控制措施",
      "definition_en": "Control measures to reduce risk and ensure compliance and quality"
    },
    {
      "id": "Risk",
      "label_zh": "风险",
      "label_en": "Risk",
      "parent": "Governance",
      "abstract": false,
      "status": "stable",
      "since": "1.0.0",
      "definition": "可能影响目标实现的不确定事件或状态",
      "definition_en": "Uncertain events or conditions that may affect goal achievement"
    },
    {
      "id": "Operational",
      "label_zh": "运营",
      "label_en": "Operational",
      "parent": null,
      "abstract": true,
      "status": "stable",
      "since": "2.0.0",
      "definition": "描述组织运作方式的抽象域，包含角色、能力、流程与事件",
      "definition_en": "Abstract domain describing how an organization operates, including roles, capabilities, processes, and events"
    },
    {
      "id": "Role",
      "label_zh": "角色",
      "label_en": "Role",
      "parent": "Operational",
      "abstract": false,
      "status": "stable",
      "since": "1.0.0",
      "definition": "主体在某一上下文中承担的身份或职责",
      "definition_en": "An identity or responsibility assumed by a party in a given context"
    },
    {
      "id": "Capability",
      "label_zh": "能力",
      "label_en": "Capability",
      "parent": "Operational",
      "abstract": false,
      "status": "stable",
      "since": "1.0.0",
      "definition": "组织稳定具备且可被复用的业务能力",
      "definition_en": "A stable and reusable business capability possessed by an organization"
    },
    {
      "id": "Process",
      "label_zh": "流程",
      "label_en": "Process",
      "parent": "Operational",
      "abstract": false,
      "status": "stable",
      "since": "1.0.0",
      "definition": "为实现业务目标而定义的端到端活动序列，可通过 part_of 关系表达子活动",
      "definition_en": "An end-to-end sequence of activities defined to achieve business objectives; sub-activities expressed via part_of relation"
    },
    {
      "id": "Event",
      "label_zh": "事件",
      "label_en": "Event",
      "parent": "Operational",
      "abstract": false,
      "status": "stable",
      "since": "1.0.0",
      "definition": "发生在业务或技术环境中的状态变化",
      "definition_en": "A state change occurring in the business or technical environment"
    },
    {
      "id": "Measurement",
      "label_zh": "度量",
      "label_en": "Measurement",
      "parent": null,
      "abstract": true,
      "status": "stable",
      "since": "2.0.0",
      "definition": "描述目标设定与绩效衡量的抽象域",
      "definition_en": "Abstract domain for goal-setting and performance measurement"
    },
    {
      "id": "Goal",
      "label_zh": "目标",
      "label_en": "Goal",
      "parent": "Measurement",
      "abstract": false,
      "status": "stable",
      "since": "1.0.0",
      "definition": "组织希望达成的结果",
      "definition_en": "Outcomes an organization aims to achieve"
    },
    {
      "id": "KPI",
      "label_zh": "关键指标",
      "label_en": "Key Performance Indicator",
      "parent": "Measurement",
      "abstract": false,
      "status": "stable",
      "since": "1.0.0",
      "definition": "衡量目标达成程度的指标",
      "definition_en": "Metrics that measure the degree of goal achievement"
    }
  ],
  "attributes": [
    {
      "id": "name",
      "label_zh": "名称",
      "label_en": "Name",
      "owner_class": "Entity",
      "datatype": "string",
      "required": true,
      "status": "stable",
      "since": "2.1.0",
      "definition": "实体的正式名称，所有子类继承",
      "definition_en": "Formal name of the entity; inherited by all subclasses"
    },
    {
      "id": "description",
      "label_zh": "描述",
      "label_en": "Description",
      "owner_class": "Entity",
      "datatype": "string",
      "required": false,
      "status": "stable",
      "since": "2.1.0",
      "definition": "对实体的自由文本描述",
      "definition_en": "Free-text description of the entity"
    },
    {
      "id": "email",
      "label_zh": "电子邮箱",
      "label_en": "Email",
      "owner_class": "Person",
      "datatype": "string",
      "required": false,
      "status": "stable",
      "since": "2.1.0",
      "definition": "人员的电子邮箱地址",
      "definition_en": "Email address of a person"
    },
    {
      "id": "effective_date",
      "label_zh": "生效日期",
      "label_en": "Effective Date",
      "owner_class": "Policy",
      "datatype": "date",
      "required": false,
      "status": "stable",
      "since": "2.1.0",
      "definition": "政策开始生效的日期",
      "definition_en": "Date when the policy becomes effective"
    },
    {
      "id": "severity",
      "label_zh": "严重程度",